{
  "schema_version": 1,
  "event_id": "evt-delivery-0002",
  "event_time": "2026-08-27T09:30:00.123Z",
  "ingest_time": "2026-08-27T09:30:01.012Z",
  "request_id": "req-0002",
  "session_id_hash": "sha256:aaaaaaaaaaaaaaaaaaaaaaaaaaaaaaaaaaaaaaaaaaaaaaaaaaaaaaaaaaaaaaaa",
  "content_id": "demo-live",
  "object_type": "segment",
  "path_template": "/live/{stream}/{segment}.m4s",
  "node_id": "edge-syd-a",
  "location": "au-sydney",
  "network_id": "as-synthetic-1221",
  "cache_status": "MISS",
  "http_status": 200,
  "bytes_sent": 842331,
  "ttfb_ms": 31.4,
  "transfer_ms": 422.1,
  "origin_ms": 87.5,
  "segment_duration_ms": 2000,
  "bitrate_bps": 3000000,
  "trace_id": "trace-0002",
  "sample_weight": 1.0
}
